tag,title,description,img,link,pixel
python,2022 Complete Python Bootcamp From Zero to Hero in Python, Learn Python like a Professional. Start from the basics and go all the way to creating your own applications and games!,https://img-c.udemycdn.com/course/480x270/567828_67d0.jpg,https://click.linksynergy.com/link?id=zOWbNCBDzko&offerid=1060092.567828&type=2&murl=https%3A%2F%2Fwww.udemy.com%2Fcourse%2Fcomplete-python-bootcamp%2F,https://ad.linksynergy.com/fs-bin/show?id=zOWbNCBDzko&bids=1060092.567828&type=2&subid=0
linux,Linux Administration: The Complete Linux Bootcamp for 2022,Linux Administration (Ubuntu and CentOS) for Beginners. Get the Linux skills to boost your career and get ahead.,https://img-c.udemycdn.com/course/480x270/3371848_9ea9_6.jpg,https://click.linksynergy.com/link?id=zOWbNCBDzko&offerid=1060092.3371848&type=2&murl=https%3A%2F%2Fwww.udemy.com%2Fcourse%2Fmaster-linux-administration%2F,https://ad.linksynergy.com/fs-bin/show?id=zOWbNCBDzko&bids=1060092.3371848&type=2&subid=0
ubuntu,Ubuntu Linux Fundamentals Linux Server Administration Basics,Updated for Ubuntu 20.04 - The Latest! Gain essential skills with Linux Server in this 11 hour Beginner's course.,https://img-c.udemycdn.com/course/480x270/1394254_2eb5_6.jpg,https://click.linksynergy.com/link?id=zOWbNCBDzko&offerid=1060092.1394254&type=2&murl=https%3A%2F%2Fwww.udemy.com%2Fcourse%2Fubuntu-server-fundamentals-manage-linux-server-with-ubuntu%2F,https://ad.linksynergy.com/fs-bin/show?id=zOWbNCBDzko&bids=1060092.1394254&type=2&subid=0
aws,Ultimate AWS Certified Solutions Architect Associate 2022,Full Practice Exam Learn Cloud Computing Pass the AWS Certified Solutions Architect Associate Certification SAA-C02!,https://img-c.udemycdn.com/course/480x270/2196488_8fc7_7.jpg,https://click.linksynergy.com/link?id=zOWbNCBDzko&offerid=1060092.2196488&type=2&murl=https%3A%2F%2Fwww.udemy.com%2Fcourse%2Faws-certified-solutions-architect-associate-saa-c02%2F,https://ad.linksynergy.com/fs-bin/show?id=zOWbNCBDzko&bids=1060092.2196488&type=2&subid=0
firebase,The Complete Angular Course: Beginner to Advanced,Learn Angular from scratch and build powerful web applications with the latest tools.,https://img-c.udemycdn.com/course/480x270/1247828_32bb.jpg,https://click.linksynergy.com/link?id=zOWbNCBDzko&offerid=1060092.1247828&type=2&murl=https%3A%2F%2Fwww.udemy.com%2Fcourse%2Fthe-complete-angular-master-class%2F,https://ad.linksynergy.com/fs-bin/show?id=zOWbNCBDzko&bids=1060092.1247828&type=2&subid=0